[
  {
    "case_id": "bm-ref-0001",
    "condition": "single_branch",
    "provider": "zhipu",
    "model": "glm-4.5-flash",
    "model_revision": null,
    "reasoning_mode": "provider-default",
    "reasoning_observed": true,
    "temperature": 0,
    "answer_raw": "Not established  \nNot established",
    "answer_extracted": "not established not established",
    "answer_correct": false,
    "format_compliant": false,
    "adopted_stale_answer": null,
    "adopted_distractor_answer": false,
    "mentioned_stale_value": null,
    "mentioned_distractor_value": false,
    "input_tokens": 139,
    "output_tokens": 245,
    "cached_tokens": 4,
    "cost": 0,
    "currency": "CNY",
    "latency_ms": 35061,
    "run_date": "2026-08-16",
    "compiler_version": "2.0.0",
    "scorer_version": "3.1.0",
    "cache_key": "c7f2d16f0de96c4f01d40af4bdb7bb3ae90ae3aeef2ef8e3e879b9ebe134d1fd"
  },
  {
    "case_id": "bm-ref-0001",
    "condition": "linear_all",
    "provider": "zhipu",
    "model": "glm-4.5-flash",
    "model_revision": null,
    "reasoning_mode": "provider-default",
    "reasoning_observed": true,
    "temperature": 0,
    "answer_raw": "Wildenport  \nWildenport",
    "answer_extracted": "wildenport wildenport",
    "answer_correct": true,
    "format_compliant": true,
    "adopted_stale_answer": null,
    "adopted_distractor_answer": false,
    "mentioned_stale_value": null,
    "mentioned_distractor_value": false,
    "input_tokens": 234,
    "output_tokens": 266,
    "cached_tokens": 94,
    "cost": 0,
    "currency": "CNY",
    "latency_ms": 12044,
    "run_date": "2026-08-16",
    "compiler_version": "2.0.0",
    "scorer_version": "3.1.0",
    "cache_key": "980da161d7aa5e2a8912f96ba191bbb6c9b3d8c58a64b5ef021f47ab2fe8c231"
  },
  {
    "case_id": "bm-ref-0001",
    "condition": "linear_all_padded",
    "provider": "zhipu",
    "model": "glm-4.5-flash",
    "model_revision": null,
    "reasoning_mode": "provider-default",
    "reasoning_observed": true,
    "temperature": 0,
    "answer_raw": "Wildenport  \nWildenport",
    "answer_extracted": "wildenport wildenport",
    "answer_correct": true,
    "format_compliant": true,
    "adopted_stale_answer": null,
    "adopted_distractor_answer": false,
    "mentioned_stale_value": null,
    "mentioned_distractor_value": false,
    "input_tokens": 227,
    "output_tokens": 253,
    "cached_tokens": 133,
    "cost": 0,
    "currency": "CNY",
    "latency_ms": 10304,
    "run_date": "2026-08-16",
    "compiler_version": "2.0.0",
    "scorer_version": "3.1.0",
    "cache_key": "3ff44ad7a287d8d301163a45fffdaaf51149c707771b7d377665d1b2bdf5b6e9"
  },
  {
    "case_id": "bm-ref-0001",
    "condition": "selected_merge",
    "provider": "zhipu",
    "model": "glm-4.5-flash",
    "model_revision": null,
    "reasoning_mode": "provider-default",
    "reasoning_observed": true,
    "temperature": 0,
    "answer_raw": "Wildenport  \nWildenport",
    "answer_extracted": "wildenport wildenport",
    "answer_correct": true,
    "format_compliant": true,
    "adopted_stale_answer": null,
    "adopted_distractor_answer": false,
    "mentioned_stale_value": null,
    "mentioned_distractor_value": false,
    "input_tokens": 178,
    "output_tokens": 247,
    "cached_tokens": 133,
    "cost": 0,
    "currency": "CNY",
    "latency_ms": 7823,
    "run_date": "2026-08-16",
    "compiler_version": "2.0.0",
    "scorer_version": "3.1.0",
    "cache_key": "c3bb8408dda0eded61ad6577eb3c804e9954f858c769bc15a69542905bbea10a"
  },
  {
    "case_id": "bm-ref-0001",
    "condition": "wrong_merge_irrelevant",
    "provider": "zhipu",
    "model": "glm-4.5-flash",
    "model_revision": null,
    "reasoning_mode": "provider-default",
    "reasoning_observed": true,
    "temperature": 0,
    "answer_raw": "Based solely on the information established in this conversation:  \nThe birthplace of the director Lena Varkonen was not mentioned.  \n\nKellamoor",
    "answer_extracted": "based solely on the information established in this conversa",
    "answer_correct": false,
    "format_compliant": false,
    "adopted_stale_answer": null,
    "adopted_distractor_answer": true,
    "mentioned_stale_value": null,
    "mentioned_distractor_value": true,
    "input_tokens": 195,
    "output_tokens": 336,
    "cached_tokens": 94,
    "cost": 0,
    "currency": "CNY",
    "latency_ms": 11020,
    "run_date": "2026-08-16",
    "compiler_version": "2.0.0",
    "scorer_version": "3.1.0",
    "cache_key": "dac60d99bba8eab2b6d976585699430a3182a6dcd84a283f2259355bc1932581"
  },
  {
    "case_id": "bm-ref-0001",
    "condition": "wrong_merge_conflict",
    "provider": "zhipu",
    "model": "glm-4.5-flash",
    "model_revision": null,
    "reasoning_mode": "provider-default",
    "reasoning_observed": true,
    "temperature": 0,
    "answer_raw": "Wildenport  \nWildenport",
    "answer_extracted": "wildenport wildenport",
    "answer_correct": true,
    "format_compliant": true,
    "adopted_stale_answer": null,
    "adopted_distractor_answer": false,
    "mentioned_stale_value": null,
    "mentioned_distractor_value": false,
    "input_tokens": 230,
    "output_tokens": 220,
    "cached_tokens": 133,
    "cost": 0,
    "currency": "CNY",
    "latency_ms": 8421,
    "run_date": "2026-08-16",
    "compiler_version": "2.0.0",
    "scorer_version": "3.1.0",
    "cache_key": "4e02d45d1b49ba79a938d15ff647bcbaf97747b7087a2f23b4e26778b43caaed"
  },
  {
    "case_id": "cd-ref-0001",
    "condition": "raw_full",
    "provider": "zhipu",
    "model": "glm-4.5-flash",
    "model_revision": null,
    "reasoning_mode": "provider-default",
    "reasoning_observed": true,
    "temperature": 0,
    "answer_raw": "4%  \n4%",
    "answer_extracted": "4%",
    "answer_correct": true,
    "format_compliant": false,
    "adopted_stale_answer": false,
    "adopted_distractor_answer": null,
    "mentioned_stale_value": false,
    "mentioned_distractor_value": null,
    "input_tokens": 329,
    "output_tokens": 185,
    "cached_tokens": 4,
    "cost": 0,
    "currency": "CNY",
    "latency_ms": 6005,
    "run_date": "2026-08-16",
    "compiler_version": "2.0.0",
    "scorer_version": "3.1.0",
    "cache_key": "3b68e19e38ac78eed60636e57de95e7411ceb0d4ba5ed00462217a5fb4f27fc6"
  },
  {
    "case_id": "cd-ref-0001",
    "condition": "dropped_detours",
    "provider": "zhipu",
    "model": "glm-4.5-flash",
    "model_revision": null,
    "reasoning_mode": "provider-default",
    "reasoning_observed": true,
    "temperature": 0,
    "answer_raw": "4%  \n4%",
    "answer_extracted": "4%",
    "answer_correct": true,
    "format_compliant": false,
    "adopted_stale_answer": false,
    "adopted_distractor_answer": null,
    "mentioned_stale_value": false,
    "mentioned_distractor_value": null,
    "input_tokens": 218,
    "output_tokens": 92,
    "cached_tokens": 102,
    "cost": 0,
    "currency": "CNY",
    "latency_ms": 2781,
    "run_date": "2026-08-16",
    "compiler_version": "2.0.0",
    "scorer_version": "3.1.0",
    "cache_key": "ad4ebd8d222e90197e6fa86237d8707e5bfed667e73fc8a65472042b018dadad"
  },
  {
    "case_id": "cd-ref-0001",
    "condition": "fixed_condense",
    "provider": "zhipu",
    "model": "glm-4.5-flash",
    "model_revision": null,
    "reasoning_mode": "provider-default",
    "reasoning_observed": true,
    "temperature": 0,
    "answer_raw": "4%",
    "answer_extracted": "4%",
    "answer_correct": true,
    "format_compliant": true,
    "adopted_stale_answer": false,
    "adopted_distractor_answer": null,
    "mentioned_stale_value": false,
    "mentioned_distractor_value": null,
    "input_tokens": 112,
    "output_tokens": 229,
    "cached_tokens": 4,
    "cost": 0,
    "currency": "CNY",
    "latency_ms": 9954,
    "run_date": "2026-08-16",
    "compiler_version": "2.0.0",
    "scorer_version": "3.1.0",
    "cache_key": "63f636aa17379da96458fc1fe0ba7d5d5c4f0109a19ab68cb1631c18244ba988"
  },
  {
    "case_id": "cd-ref-0001",
    "condition": "lossy_condense",
    "provider": "zhipu",
    "model": "glm-4.5-flash",
    "model_revision": null,
    "reasoning_mode": "provider-default",
    "reasoning_observed": true,
    "temperature": 0,
    "answer_raw": "4",
    "answer_extracted": "4%",
    "answer_correct": true,
    "format_compliant": true,
    "adopted_stale_answer": false,
    "adopted_distractor_answer": null,
    "mentioned_stale_value": false,
    "mentioned_distractor_value": null,
    "input_tokens": 100,
    "output_tokens": 279,
    "cached_tokens": 30,
    "cost": 0,
    "currency": "CNY",
    "latency_ms": 8083,
    "run_date": "2026-08-16",
    "compiler_version": "2.0.0",
    "scorer_version": "3.1.0",
    "cache_key": "a4987aafac0f37ec5001aa2a205655e3c7356874c74bb1b5010b6d5f057c80ea"
  },
  {
    "case_id": "rp-ref-0001-k1",
    "condition": "clean",
    "provider": "zhipu",
    "model": "glm-4.5-flash",
    "model_revision": null,
    "reasoning_mode": "provider-default",
    "reasoning_observed": true,
    "temperature": 0,
    "answer_raw": "The full capacity of the workshop is determined by adding the seating capacity from the benches and the standing places. With 7 benches each seating 3 people, the seating capacity is 7 × 3 = 21. Adding the 5 standing places gives a total capacity of 21 + 5 = 26.  \n26",
    "answer_extracted": "26",
    "answer_correct": true,
    "format_compliant": false,
    "adopted_stale_answer": null,
    "adopted_distractor_answer": false,
    "mentioned_stale_value": null,
    "mentioned_distractor_value": false,
    "input_tokens": 139,
    "output_tokens": 707,
    "cached_tokens": 126,
    "cost": 0,
    "currency": "CNY",
    "latency_ms": 53649,
    "run_date": "2026-08-16",
    "compiler_version": "2.0.0",
    "scorer_version": "3.1.0",
    "cache_key": "b9ce6339c9f3015cc068ddda01b56cc9ca7f9b252ff94079c1ee9cfea5f1a6c4"
  },
  {
    "case_id": "rp-ref-0001-k1",
    "condition": "polluted",
    "provider": "zhipu",
    "model": "glm-4.5-flash",